{
  "slug": "덮인물길",
  "title": "자유주제 — 덮인 물길",
  "logline": "해원시 중앙로 밑에는 하수관이 아니라 덮인 강이 흐른다. 장마 끝물 아침, 노점 앞 맨홀에서 흙빛 물이 솟고, 마흔 해를 그 자리에서 장사한 노인이 강 이름을 대며 신고하지만 접수는 하수도 항목으로 내려간다. 도로가 꺼지기까지 한 시간 사십 분, 아래에는 아무도 모르게 내려간 사람 둘이 있다.",
  "clock": {
    "start": "08:12",
    "end": "10:40"
  },
  "dday": null
}
